Name	Url	Description	DataTypes	DefaultTask	AttributeTypes	NumberOfInstances	NumberOfAttributes	Year	Category
Online Handwritten Assamese Characters Dataset	https://archive.ics.uci.edu/ml/datasets/Online+Handwritten+Assamese+Characters+Dataset	This is a dataset of 8235 online handwritten assamese characters. The â€œonlineâ€ process involves capturing of data as text is written on a digitizing tablet with an electronic pen.	Multivariate, Sequential 	Classification 	Integer 	8235 		2011 	Computer
PubChem Bioassay Data	https://archive.ics.uci.edu/ml/datasets/PubChem+Bioassay+Data	These highly imbalanced bioassay datasets are from the differing types of screening that can be performed using HTS technology. 21 datasets were created from 12 bioassays.	Multivariate 	Classification 	Integer, Real 			2011 	Life
Record Linkage Comparison Patterns	https://archive.ics.uci.edu/ml/datasets/Record+Linkage+Comparison+Patterns	Element-wise comparison of records with personal data from a record linkage setting. The task is to decide from a comparison pattern whether the underlying records belong to one person.	Multivariate 	Classification 	Real 	5749132 	12 	2011 	Other
Communities and Crime Unnormalized	https://archive.ics.uci.edu/ml/datasets/Communities+and+Crime+Unnormalized	Communities in the US. Data combines socio-economic data from the '90 Census, law enforcement data from the 1990 Law Enforcement Management and Admin Stats survey, and crime data from the 1995 FBI UCR	Multivariate 	Regression 	Real 	2215 	147 	2011 	Social
Vertebral Column	https://archive.ics.uci.edu/ml/datasets/Vertebral+Column	Data set containing values for six biomechanical features used to classify orthopaedic patients into 3 classes (normal, disk hernia or spondilolysthesis) or 2 classes (normal or abnormal).	Multivariate 	Classification 	Real 	310 	6 	2011 	
EMG Physical Action Data Set	https://archive.ics.uci.edu/ml/datasets/EMG+Physical+Action+Data+Set	The Physical Action Data Set includes 10 normal and 10 aggressive physical actions that measure the human activity. The data have been collected by 4 subjects using the Delsys EMG wireless apparatus.	Time-Series 	Classification 	Real 	10000 	8 	2011 	Physical
Vicon Physical Action Data Set	https://archive.ics.uci.edu/ml/datasets/Vicon+Physical+Action+Data+Set	The Physical Action Data Set includes 10 normal and 10 aggressive physical actions that measure the human activity. The data have been collected by 10 subjects using the Vicon 3D tracker.	Time-Series 	Classification 	Real 	3000 	27 	2011 	Physical
Amazon Commerce reviews set	https://archive.ics.uci.edu/ml/datasets/Amazon+Commerce+reviews+set	The dataset is used for authorship identification in online Writeprint which is a new research field of pattern recognition.	Multivariate, Text, Domain-Theory 	Classification 	Real 	1500 	10000 	2011 	Physical
Amazon Access Samples	https://archive.ics.uci.edu/ml/datasets/Amazon+Access+Samples	Amazon's InfoSec is getting smarter about the way Access data is leveraged. This is an anonymized sample of access provisioned within the company.	Time-Series, Domain-Theory 	Regression, Clustering, Causal-Discovery 		30000 	20000 	2011 	Business
Reuter_50_50	https://archive.ics.uci.edu/ml/datasets/Reuter_50_50	The dataset is used for authorship identification in online Writeprint which is a new research field of pattern recognition.	Multivariate, Text, Domain-Theory 	Classification, Clustering 	Real 	2500 	10000 	2011 	Computer
Farm Ads	https://archive.ics.uci.edu/ml/datasets/Farm+Ads	This data was collected from text ads found on twelve websites that deal with various farm animal related topics. The binary labels are based on whether or not the content owner approves of the ad.	Text 	Classification 		4143 	54877 	2011 	Business
DBWorld e-mails	https://archive.ics.uci.edu/ml/datasets/DBWorld+e-mails	It contains 64 e-mails which I have manually collected from DBWorld mailing list. They are classified in: 'announces of conferences' and 'everything else'.	Text 	Classification 		64 	4702 	2011 	Computer
KEGG Metabolic Relation Network (Directed)	https://archive.ics.uci.edu/ml/datasets/KEGG+Metabolic+Relation+Network+%28Directed%29	KEGG Metabolic pathways modeled as directed relation network. Variety of graphical features presented.	Multivariate, Univariate, Text 	Classification, Regression, Clustering 	Integer, Real 	53414 	24 	2011 	Life
KEGG Metabolic Reaction Network (Undirected)	https://archive.ics.uci.edu/ml/datasets/KEGG+Metabolic+Reaction+Network+%28Undirected%29	KEGG Metabolic pathways modeled as un-directed reaction network. Variety of graphical features presented.	Multivariate, Univariate, Text 	Classification, Regression, Clustering 	Integer, Real 	65554 	29 	2011 	Life
Bank Marketing	https://archive.ics.uci.edu/ml/datasets/Bank+Marketing	The data is related with direct marketing campaigns (phone calls) of a Portuguese banking institution. The classification goal is to predict if the client will subscribe a term deposit (variable y).	Multivariate 	Classification 	Real 	45211 	17 	2012 	Business
YouTube Comedy Slam Preference Data	https://archive.ics.uci.edu/ml/datasets/YouTube+Comedy+Slam+Preference+Data	This dataset provides user vote data on which video from a pair of videos is funnier collected on YouTube Comedy Slam. The task is to automatically predict this preference based on video metadata.	Text 	Classification 		1138562 	3 	2012 	Computer
Gas Sensor Array Drift Dataset	https://archive.ics.uci.edu/ml/datasets/Gas+Sensor+Array+Drift+Dataset	This archive contains 13910 measurements from 16 chemical sensors utilized in simulations for drift compensation in a discrimination task of 6 gases at various levels of concentrations.	Multivariate 	Classification 	Real 	13910 	128 	2012 	Computer
ILPD (Indian Liver Patient Dataset)	https://archive.ics.uci.edu/ml/datasets/ILPD+%28Indian+Liver+Patient+Dataset%29	This data set contains 10 variables that are age, gender, total Bilirubin, direct Bilirubin, total proteins, albumin, A/G ratio, SGPT, SGOT and Alkphos.	Multivariate 	Classification 	Integer, Real 	583 	10 	2012 	Life
OPPORTUNITY Activity Recognition	https://archive.ics.uci.edu/ml/datasets/OPPORTUNITY+Activity+Recognition	The OPPORTUNITY Dataset for Human Activity Recognition from Wearable, Object, and Ambient Sensors is a dataset devised to benchmark human activity recognition algorithms (classification, automatic data segmentation, sensor fusion, feature extraction, etc).	Multivariate, Time-Series 	Classification 	Real 	2551 	242 	2012 	Computer
Nomao	https://archive.ics.uci.edu/ml/datasets/Nomao	Nomao collects data about places (name, phone, localization...) from many sources. Deduplication consists in detecting what data refer to the same place. Instances in the dataset compare 2 spots.	Univariate 	Classification 	Real 	34465 	120 	2012 	Computer
SMS Spam Collection	https://archive.ics.uci.edu/ml/datasets/SMS+Spam+Collection	The SMS Spam Collection is a public set of SMS labeled messages that have been collected for mobile phone spam research.	Multivariate, Text, Domain-Theory 	Classification, Clustering 	Real 	5574 		2012 	Computer
Skin Segmentation	https://archive.ics.uci.edu/ml/datasets/Skin+Segmentation	The Skin Segmentation dataset is constructed over B, G, R color space. Skin and Nonskin dataset is generated using skin textures from face images of diversity of age, gender, and race people.	Univariate 	Classification 	Real 	245057 	4 	2012 	Computer
Planning Relax	https://archive.ics.uci.edu/ml/datasets/Planning+Relax	The dataset concerns with the classification of two mental stages from recorded EEG signals: Planning (during imagination of motor act) and Relax state.	Univariate 	Classification 	Real 	182 	13 	2012 	Computer
PAMAP2 Physical Activity Monitoring	https://archive.ics.uci.edu/ml/datasets/PAMAP2+Physical+Activity+Monitoring	The PAMAP2 Physical Activity Monitoring dataset contains data of 18 different physical activities, performed by 9 subjects wearing 3 inertial measurement units and a heart rate monitor.	Multivariate, Time-Series 	Classification 	Real 	3850505 	52 	2012 	Computer
Restaurant & consumer data	https://archive.ics.uci.edu/ml/datasets/Restaurant+%26+consumer+data	The dataset was obtained from a recommender system prototype. The task was to generate a top-n list of restaurants according to the consumer preferences.	Multivariate 			138 	47 	2012 	Computer
CNAE-9	https://archive.ics.uci.edu/ml/datasets/CNAE-9	This is a data set containing 1080 documents of free text business descriptions of Brazilian companies categorized into a subset of 9 categories	Multivariate, Text 	Classification 	Integer 	1080 	857 	2012 	Business
Individual household electric power consumption	https://archive.ics.uci.edu/ml/datasets/Individual+household+electric+power+consumption	Measurements of electric power consumption in one household with a one-minute sampling rate over a period of almost 4 years. Different electrical quantities and some sub-metering values are available.	Multivariate, Time-Series 	Regression, Clustering 	Real 	2075259 	9 	2012 	Physical
seeds	https://archive.ics.uci.edu/ml/datasets/seeds	Measurements of geometrical properties of kernels belonging to three different varieties of wheat. A soft X-ray technique and GRAINS package were used to construct all seven, real-valued attributes.	Multivariate 	Classification, Clustering 	Real 	210 	7 	2012 	Life
Northix	https://archive.ics.uci.edu/ml/datasets/Northix	Northix is designed to be a schema matching benchmark problem for data integration of two entity relationship databases.	Multivariate, Univariate, Text 	Classification 	Integer, Real 	115 	200 	2012 	Computer
QtyT40I10D100K	https://archive.ics.uci.edu/ml/datasets/QtyT40I10D100K	Since there is no numerical sequential data stream available in standard data sets, this data set is generated from the original T40I10D100K data set	Sequential 		Integer 	3960456 	4 	2012 	
Legal Case Reports	https://archive.ics.uci.edu/ml/datasets/Legal+Case+Reports	A textual corpus of 4000 legal cases for automatic summarization and citation analysis. For each document we collect catchphrases, citations sentences, citation catchphrases and citation classes.	Text 	Classification 				2012 	Other
Human Activity Recognition Using Smartphones	https://archive.ics.uci.edu/ml/datasets/Human+Activity+Recognition+Using+Smartphones	Human Activity Recognition database built from the recordings of 30 subjects performing activities of daily living (ADL) while carrying a waist-mounted smartphone with embedded inertial sensors.	Multivariate, Time-Series 	Classification, Clustering 		10299 	561 	2012 	Computer
One-hundred plant species leaves data set	https://archive.ics.uci.edu/ml/datasets/One-hundred+plant+species+leaves+data+set	Sixteen samples of leaf each of one-hundred plant species. For each sample, a shape descriptor, fine scale margin and texture histogram are given.		Classification 	Real 	1600 	64 	2012 	Life
Energy efficiency	https://archive.ics.uci.edu/ml/datasets/Energy+efficiency	This study looked into assessing the heating load and cooling load requirements of buildings (that is, energy efficiency) as a function of building parameters.	Multivariate 	Classification, Regression 	Integer, Real 	768 	8 	2012 	Computer
Yacht Hydrodynamics	https://archive.ics.uci.edu/ml/datasets/Yacht+Hydrodynamics	Delft data set, used to predict the hydodynamic performance of sailing yachts from dimensions and velocity.	Multivariate 	Regression 	Real 	308 	7 	2013 	Physical
Fertility	https://archive.ics.uci.edu/ml/datasets/Fertility	100 volunteers provide a semen sample analyzed according to the WHO 2010 criteria. Sperm concentration are related to socio-demographic data, environmental factors, health status, and life habits	Multivariate 	Classification, Regression 	Real 	100 	10 	2013 	Life
Daphnet Freezing of Gait	https://archive.ics.uci.edu/ml/datasets/Daphnet+Freezing+of+Gait	This dataset contains the annotated readings of 3 acceleration sensors at the hip and leg of Parkinson's disease patients that experience freezing of gait (FoG) during walking tasks.	Multivariate, Time-Series 	Classification 	Real 	237 	9 	2013 	Life
3D Road Network (North Jutland, Denmark)	https://archive.ics.uci.edu/ml/datasets/3D+Road+Network+%28North+Jutland%2C+Denmark%29	3D road network with highly accurate elevation information (+-20cm) from Denmark used in eco-routing and fuel/Co2-estimation routing algorithms.	Sequential, Text 	Regression, Clustering 	Real 	434874 	4 	2013 	Computer
ISTANBUL STOCK EXCHANGE	https://archive.ics.uci.edu/ml/datasets/ISTANBUL+STOCK+EXCHANGE	Data sets includes returns of Istanbul Stock Exchange with seven other international index; SP, DAX, FTSE, NIKKEI, BOVESPA, MSCE_EU, MSCI_EM from Jun 5, 2009 to Feb 22, 2011.	Multivariate, Univariate, Time-Series 	Classification, Regression 	Real 	536 	8 	2013 	Business
Buzz in social media	https://archive.ics.uci.edu/ml/datasets/Buzz+in+social+media+	This data-set contains examples of buzz events from two different social networks: Twitter, and Tom's Hardware, a forum network focusing on new technology with more conservative dynamics.	Time-Series, Multivariate 	Regression, Classification 	Integer, Real 	140000 	77 	2013 	Computer
First-order theorem proving	https://archive.ics.uci.edu/ml/datasets/First-order+theorem+proving	Given a theorem, predict which of five heuristics will give the fastest proof when used by a first-order prover. A sixth prediction declines to attempt a proof, should the theorem be too difficult.	Multivariate 	Classification 	Real 	6118 	51 	2013 	Computer
Wearable Computing: Classification of Body Postures and Movements (PUC-Rio)	https://archive.ics.uci.edu/ml/datasets/Wearable+Computing%3A+Classification+of+Body+Postures+and+Movements+%28PUC-Rio%29	A dataset with 5 classes (sitting-down, standing-up, standing, walking, and sitting) collected on 8 hours of activities of 4 healthy subjects. We also established a baseline performance index.	Sequential 	Classification 	Integer, Real 	165632 	18 	2013 	Computer
Gas sensor arrays in open sampling settings	https://archive.ics.uci.edu/ml/datasets/Gas+sensor+arrays+in+open+sampling+settings	The dataset contains 18000 time-series recordings from a chemical detection platform at six different locations in a wind tunnel facility in response to ten high-priority chemical gaseous substances	Multivariate, Time-Series 	Classification 	Real 	18000 	1950000 	2013 	Computer
Climate Model Simulation Crashes	https://archive.ics.uci.edu/ml/datasets/Climate+Model+Simulation+Crashes	Given Latin hypercube samples of 18 climate model input parameter values, predict climate model simulation crashes and determine the parameter value combinations that cause the failures.	Multivariate 	Classification 	Real 	540 	18 	2013 	Physical
MicroMass	https://archive.ics.uci.edu/ml/datasets/MicroMass	A dataset to explore machine learning approaches for the identification of microorganisms from mass-spectrometry data.	Multivariate 	Classification 	Real 	931 	1300 	2013 	Life
QSAR biodegradation	https://archive.ics.uci.edu/ml/datasets/QSAR+biodegradation	Data set containing values for 41 attributes (molecular descriptors) used to classify 1055 chemicals into 2 classes (ready and not ready biodegradable).	Multivariate 	Classification 	Integer, Real 	1055 	41 	2013 	Other
BLOGGER	https://archive.ics.uci.edu/ml/datasets/BLOGGER	In this paper, we look for to recognize the causes of users tend to cyber space in Kohkiloye and Boyer Ahmad Province in Iran	Multivariate 	Classification 		100 	6 	2013 	Computer
Daily and Sports Activities	https://archive.ics.uci.edu/ml/datasets/Daily+and+Sports+Activities	The dataset comprises motion sensor data of 19 daily and sports activities each performed by 8 subjects in their own style for 5 minutes. Five Xsens MTx units are used on the torso, arms, and legs.	Multivariate, Time-Series 	Classification, Clustering 	Real 	9120 	5625 	2013 	Computer
User Knowledge Modeling	https://archive.ics.uci.edu/ml/datasets/User+Knowledge+Modeling	It is the real dataset about the students' knowledge status about the subject of Electrical DC Machines. The dataset had been obtained from Ph.D. Thesis.	Multivariate 	Classification, Clustering 	Integer 	403 	5 	2013 	Computer
Reuters RCV1 RCV2 Multilingual, Multiview Text Categorization Test collection	https://archive.ics.uci.edu/ml/datasets/Reuters+RCV1+RCV2+Multilingual%2C+Multiview+Text+Categorization+Test+collection	This test collection contains feature characteristics of documents originally written in five different languages and their translations, over a common set of 6 categories.	Multivariate 	Classification 	Real 	111740 		2013 	Life
NYSK	https://archive.ics.uci.edu/ml/datasets/NYSK	NYSK (New York v. Strauss-Kahn) is a collection of English news articles about the case relating to allegations of sexual assault against the former IMF director Dominique Strauss-Kahn (May 2011).	Multivariate, Sequential, Text 	Clustering 		10421 	7 	2013 	Social
Turkiye Student Evaluation	https://archive.ics.uci.edu/ml/datasets/Turkiye+Student+Evaluation	This data set contains a total 5820 evaluation scores provided by students from Gazi University in Ankara (Turkey). There is a total of 28 course specific questions and additional 5 attributes.	Multivariate 	Classification, Clustering 		5820 	33 	2013 	Other
ser Knowledge Modeling Data (Students' Knowledge Levels on DC Electrical Machines)	https://archive.ics.uci.edu/ml/datasets/ser+Knowledge+Modeling+Data+%28Students%27+Knowledge+Levels+on+DC+Electrical+Machines%29	The dataset is about the users' learning activities and knowledge levels on subjects of DC Electrical Machines. The dataset had been obtained from online web-courses and reported in my Ph.D. Thesis.	Multivariate 	Classification 	Real 	403 	5 	2013 	Computer
EEG Eye State	https://archive.ics.uci.edu/ml/datasets/EEG+Eye+State	The data set consists of 14 EEG values and a value indicating the eye state.	Multivariate, Sequential, Time-Series 	Classification 	Integer, Real 	14980 	15 	2013 	Life
Physicochemical Properties of Protein Tertiary Structure	https://archive.ics.uci.edu/ml/datasets/Physicochemical+Properties+of+Protein+Tertiary+Structure	This is a data set of Physicochemical Properties of Protein Tertiary Structure. The data set is taken from CASP 5-9. There are 45730 decoys and size varying from 0 to 21 armstrong.	Multivariate 	Regression 	Real 	45730 	9 	2013 	Life
seismic-bumps	https://archive.ics.uci.edu/ml/datasets/seismic-bumps	The data describe the problem of high energy (higher than 10^4 J) seismic bumps forecasting in a coal mine. Data come from two of longwalls located in a Polish coal mine.	Multivariate 	Classification 	Real 	2584 	19 	2013 	Other
banknote authentication	https://archive.ics.uci.edu/ml/datasets/banknote+authentication	Data were extracted from images that were taken for the evaluation of an authentication procedure for banknotes.	Multivariate 	Classification 	Real 	1372 	5 	2013 	Computer
USPTO Algorithm Challenge, run by NASA-Harvard Tournament Lab and TopCoder Problem: Pat	https://archive.ics.uci.edu/ml/datasets/USPTO+Algorithm+Challenge%2C+run+by+NASA-Harvard+Tournament+Lab+and+TopCoder++++Problem%3A+Pat	Data used for USPTO Algorithm Competition. Contains drawing pages from US patents with manually labeled figure and part labels.	Domain-Theory 	Classification 	Integer 	306 	5 	2013 	Other
YouTube Multiview Video Games Dataset	https://archive.ics.uci.edu/ml/datasets/YouTube+Multiview+Video+Games+Dataset	This dataset contains about 120k instances, each described by 13 feature types, with class information, specially useful for exploring multiview topics (cotraining, ensembles, clustering,..).	Multivariate, Text 	Classification, Clustering 	Integer, Real 	120000 	1000000 	2013 	Computer
Gas Sensor Array Drift Dataset at Different Concentrations	https://archive.ics.uci.edu/ml/datasets/Gas+Sensor+Array+Drift+Dataset+at+Different+Concentrations	This archive contains 13910 measurements from 16 chemical sensors exposed to 6 different gases at various concentration levels.	Multivariate, Time-Series 	Classification, Regression, Clustering, Causa 	Real 	13910 	129 	2013 	Computer
Activities of Daily Living (ADLs) Recognition Using Binary Sensors	https://archive.ics.uci.edu/ml/datasets/Activities+of+Daily+Living+%28ADLs%29+Recognition+Using+Binary+Sensors	This dataset comprises information regarding the ADLs performed by two users on a daily basis in their own homes.	Multivariate, Sequential, Time-Series 	Classification, Clustering 		2747 		2013 	Computer
SkillCraft1 Master Table Dataset	https://archive.ics.uci.edu/ml/datasets/SkillCraft1+Master+Table+Dataset	This data was used in Thompson et al. (2013). A list of possible game actions is discussed in Thompson, Blair, Chen, & Henrey (2013).	Multivariate 	Regression 	Integer, Real 	3395 	20 	2013 	Game
Weight Lifting Exercises monitored with Inertial Measurement Units	https://archive.ics.uci.edu/ml/datasets/Weight+Lifting+Exercises+monitored+with+Inertial+Measurement+Units	Six young health subjects were asked to perform 5 variations of the biceps curl weight lifting exercise. One of the variations is the one predicted by the health professional.	Multivariate 	Classification 	Real 	39242 	152 	2013 	Physical
SML2010	https://archive.ics.uci.edu/ml/datasets/SML2010	This dataset is collected from a monitor system mounted in a domotic house. It corresponds to approximately 40 days of monitoring data.	Multivariate, Sequential, Time-Series, Text 	Regression 	Real 	4137 	24 	2014 	Computer
Bike Sharing Dataset	https://archive.ics.uci.edu/ml/datasets/Bike+Sharing+Dataset	This dataset contains the hourly and daily count of rental bikes between years 2011 and 2012 in Capital bikeshare system with the corresponding weather and seasonal information.	Univariate 	Regression 	Integer, Real 	17389 	16 	2013 	Social
Predict keywords activities in a online social media	https://archive.ics.uci.edu/ml/datasets/Predict+keywords+activities+in+a+online+social+media	The data from Twitter was collected during 360 consecutive days. It was done by querying 1497 English keywords sampled from Wikipedia. This dataset is proposed in a Learning to rank setting.	Multivariate, Sequential, Time-Series 		Integer, Real 	51 	35 	2013 	Computer
Thoracic Surgery Data	https://archive.ics.uci.edu/ml/datasets/Thoracic+Surgery+Data	The data is dedicated to classification problem related to the post-operative life expectancy in the lung cancer patients: class 1 - death within one year after surgery, class 2 - survival.	Multivariate 	Classification 	Integer, Real 	470 	17 	2013 	Life
EMG dataset in Lower Limb	https://archive.ics.uci.edu/ml/datasets/EMG+dataset+in+Lower+Limb	3 different exercises: sitting, standing and walking in the muscles: biceps femoris, vastus medialis, rectus femoris and semitendinosus addition to goniometry in the exercises.	Multivariate, Time-Series 		Real 	132 	5 	2014 	Computer
SUSY	https://archive.ics.uci.edu/ml/datasets/SUSY	This is a classification problem to distinguish between a signal process which produces supersymmetric particles and a background process which does not.		Classification 	Real 	5000000 	18 	2014 	Physical
HIGGS	https://archive.ics.uci.edu/ml/datasets/HIGGS	This is a classification problem to distinguish between a signal process which produces Higgs bosons and a background process which does not.		Classification 	Real 	11000000 	28 	2014 	Physical
Qualitative_Bankruptcy	https://archive.ics.uci.edu/ml/datasets/Qualitative_Bankruptcy	Predict the Bankruptcy from Qualitative parameters from experts.	Multivariate 	Classification 		250 	7 	2014 	Computer
LSVT Voice Rehabilitation	https://archive.ics.uci.edu/ml/datasets/LSVT+Voice+Rehabilitation	126 samples from 14 participants, 309 features. Aim: assess whether voice rehabilitation treatment lead to phonations considered 'acceptable' or 'unacceptable' (binary class classification problem).	Multivariate 	Classification 	Real 	126 	309 	2014 	Life
Dataset for ADL Recognition with Wrist-worn Accelerometer	https://archive.ics.uci.edu/ml/datasets/Dataset+for+ADL+Recognition+with+Wrist-worn+Accelerometer	Recordings of 16 volunteers performing 14 Activities of Daily Living (ADL) while carrying a single wrist-worn tri-axial accelerometer.	Multivariate, Time-Series 	Classification, Clustering 			3 	2014 	Computer
Wilt	https://archive.ics.uci.edu/ml/datasets/Wilt	High-resolution Remote Sensing data set (Quickbird). Small number of training samples of diseased trees, large number for other land cover. Testing data set from stratified random sample of image.	Multivariate 	Classification 		4889 	6 	2014 	Life
User Identification From Walking Activity	https://archive.ics.uci.edu/ml/datasets/User+Identification+From+Walking+Activity	The dataset collects data from an Android smartphone positioned in the chest pocket from 22 participants walking in the wild over a predefined path.	Univariate, Sequential, Time-Series 	Classification, Clustering 	Real 			2014 	Other
Activity Recognition from Single Chest-Mounted Accelerometer	https://archive.ics.uci.edu/ml/datasets/Activity+Recognition+from+Single+Chest-Mounted+Accelerometer	The dataset collects data from a wearable accelerometer mounted on the chest. The dataset is intended for Activity Recognition research purposes.	Univariate, Sequential, Time-Series 	Classification, Clustering 	Real 			2014 	Other
