Name	Url	Description	DataTypes	DefaultTask	AttributeTypes	NumberOfInstances	NumberOfAttributes	Year	Category
Coil 1999 Competition Data	https://archive.ics.uci.edu/ml/datasets/Coil+1999+Competition+Data	This data set is from the 1999 Computational Intelligence and Learning (COIL) competition. The data contains measurements of river chemical concentrations and algae densities.	Multivariate 		Categorical, Real 	340 	17 	1999 	Physical
Corel Image Features	https://archive.ics.uci.edu/ml/datasets/Corel+Image+Features	This dataset contains image features extracted from a Corel image collection. Four sets of features are available based on the color histogram, color histogram layout, color moments, and co-occurence	Multivariate 		Real 	68040 	89 	1999 	Other
E. Coli Genes	https://archive.ics.uci.edu/ml/datasets/E.+Coli+Genes	Data giving characteristics of each ORF (potential gene) in the E. coli genome. Sequence, homology (similarity to other genes) and structural information, and function (if known) are provided.	Relational 					2001 	Life
EEG Database	https://archive.ics.uci.edu/ml/datasets/EEG+Database	This data arises from a large study to examine EEG correlates of genetic predisposition to alcoholism. It contains measurements from 64 electrodes placed on the scalp sampled at 256 Hz	Multivariate, Time-Series 		Categorical, Integer, Real 	122 	4 	1999 	Life
El Nino	https://archive.ics.uci.edu/ml/datasets/El+Nino	The data set contains oceanographic and surface meteorological readings taken from a series of buoys positioned throughout the equatorial Pacific.	Spatio-temporal 		Integer, Real 	178080 	12 	1999 	Physical
Entree Chicago Recommendation Data	https://archive.ics.uci.edu/ml/datasets/Entree+Chicago+Recommendation+Data	This data contains a record of user interactions with the Entree Chicago restaurant recommendation system.	Transactional, Sequential 	Recommender-Systems 	Categorical 	50672 		2000 	Other
CMU Face Images	https://archive.ics.uci.edu/ml/datasets/CMU+Face+Images	This data consists of 640 black and white face images of people taken with varying pose (straight, left, right, up), expression (neutral, happy, sad, angry), eyes (wearing sunglasses or not), and size	Image 	Classification 	Integer 	640 		1999 	Other
Insurance Company Benchmark (COIL 2000)	https://archive.ics.uci.edu/ml/datasets/Insurance+Company+Benchmark+%28COIL+2000%29	This data set used in the CoIL 2000 Challenge contains information on customers of an insurance company. The data consists of 86 variables and includes product usage data and socio-demographic data	Multivariate 	Regression, Description 	Categorical, Integer 	9000 	86 	2000 	Social
Internet Usage Data	https://archive.ics.uci.edu/ml/datasets/Internet+Usage+Data	This data contains general demographic information on internet users in 1997.	Multivariate 		Categorical, Integer 	10104 	72 	1999 	Computer
IPUMS Census Database	https://archive.ics.uci.edu/ml/datasets/IPUMS+Census+Database	This data set contains unweighted PUMS census data from the Los Angeles and Long Beach areas for the years 1970, 1980, and 1990.	Multivariate 		Categorical, Integer 	256932 	61 	1999 	Social
Japanese Vowels	https://archive.ics.uci.edu/ml/datasets/Japanese+Vowels	This dataset records 640 time series of 12 LPC cepstrum coefficients taken from nine male speakers.	Multivariate, Time-Series 	Classification 	Real 	640 	12 		Other
KDD Cup 1998 Data	https://archive.ics.uci.edu/ml/datasets/KDD+Cup+1998+Data	This is the data set used for The Second International Knowledge Discovery and Data Mining Tools Competition, which was held in conjunction with KDD-98	Multivariate 	Regression 	Categorical, Integer 	191779 	481 	1998 	Other
KDD Cup 1999 Data	https://archive.ics.uci.edu/ml/datasets/KDD+Cup+1999+Data	This is the data set used for The Third International Knowledge Discovery and Data Mining Tools Competition, which was held in conjunction with KDD-99	Multivariate 	Classification 	Categorical, Integer 	4000000 	42 	1999 	Computer
M. Tuberculosis Genes	https://archive.ics.uci.edu/ml/datasets/M.+Tuberculosis+Genes	Data giving characteristics of each ORF (potential gene) in the M. tuberculosis bacterium. Sequence, homology (similarity to other genes) and structural information, and function (if known) are provided	Relational 					2001 	Life
Movie	https://archive.ics.uci.edu/ml/datasets/Movie	This data set contains a list of over 10000 films including many older, odd, and cult films. There is information on actors, casts, directors, producers, studios, etc.	Multivariate, Relational 			10000 		1999 	Other
MSNBC.com Anonymous Web Data	https://archive.ics.uci.edu/ml/datasets/MSNBC.com+Anonymous+Web+Data	This data describes the page visits of users who visited msnbc.com on September 28, 1999. Visits are recorded at the level of URL category (see description) and are recorded in time order.	Sequential 		Categorical 	989818 			Computer
NSF Research Award Abstracts 1990-2003	https://archive.ics.uci.edu/ml/datasets/NSF+Research+Award+Abstracts+1990-2003	This data set consists of (a) 129,000 abstracts describing NSF awards for basic research, (b) bag-of-word data files extracted from the abstracts, (c) a list of words used for indexing the bag-of-word	Text 			129000 		2003 	Other
Pioneer-1 Mobile Robot Data	https://archive.ics.uci.edu/ml/datasets/Pioneer-1+Mobile+Robot+Data	This dataset contains time series sensor readings of the Pioneer-1 mobile robot. The data is broken into "experiences" in which the robot takes action for some period of time and experiences a control	Multivariate, Time-Series 		Categorical, Real 			1999 	Computer
Pseudo Periodic Synthetic Time Series	https://archive.ics.uci.edu/ml/datasets/Pseudo+Periodic+Synthetic+Time+Series	This data set is designed for testing indexing schemes in time series databases. The data appears highly periodic, but never exactly repeats itself.	Univariate, Time-Series 			100000 		1999 	Other
Reuters-21578 Text Categorization Collection	https://archive.ics.uci.edu/ml/datasets/Reuters-21578+Text+Categorization+Collection	This is a collection of documents that appeared on Reuters newswire in 1987. The documents were assembled and indexed with categories.	Text 	Classification 	Categorical 	21578 	5 	1997 	Other
Robot Execution Failures	https://archive.ics.uci.edu/ml/datasets/Robot+Execution+Failures	This dataset contains force and torque measurements on a robot after failure detection. Each failure is characterized by 15 force/torque samples collected at regular time intervals	Multivariate, Time-Series 	Classification 	Integer 	463 	90 	1999 	Physical
Synthetic Control Chart Time Series	https://archive.ics.uci.edu/ml/datasets/Synthetic+Control+Chart+Time+Series	This data consists of synthetically generated control charts.	Time-Series 	Classification, Clustering 	Real 	600 		1999 	Other
Syskill and Webert Web Page Ratings	https://archive.ics.uci.edu/ml/datasets/Syskill+and+Webert+Web+Page+Ratings	This database contains HTML source of web pages plus the ratings of a single user on these web pages. Web pages are on four seperate subjects (Bands- recording artists; Goats; Sheep; and BioMedical)	Multivariate, Text 	Classification 	Categorical 	332 	5 	1998 	Computer
UNIX User Data	https://archive.ics.uci.edu/ml/datasets/UNIX+User+Data	This file contains 9 sets of sanitized user data drawn from the command histories of 8 UNIX computer users at Purdue over the course of up to 2 years.	Text, Sequential 						Computer
Volcanoes on Venus - JARtool experiment	https://archive.ics.uci.edu/ml/datasets/Volcanoes+on+Venus+-+JARtool+experiment	The JARtool project was a pioneering effort to develop an automatic system for cataloging small volcanoes in the large set of Venus images returned by the Magellan spacecraft.	Image 	Classification 					Physical
Statlog (Australian Credit Approval)	https://archive.ics.uci.edu/ml/datasets/Statlog+%28Australian+Credit+Approval%29	This file concerns credit card applications. This database exists elsewhere in the repository (Credit Screening Database) in a slightly different form	Multivariate 	Classification 	Categorical, Integer, Real 	690 	14 		Financial
Statlog (German Credit Data)	https://archive.ics.uci.edu/ml/datasets/Statlog+%28German+Credit+Data%29	This dataset classifies people described by a set of attributes as good or bad credit risks. Comes in two formats (one all numeric). Also comes with a cost matrix	Multivariate 	Classification 	Categorical, Integer 	1000 	20 	1994 	Financial
Statlog (Heart)	https://archive.ics.uci.edu/ml/datasets/Statlog+%28Heart%29	This dataset is a heart disease database similar to a database already present in the repository (Heart Disease databases) but in a slightly different form	Multivariate 	Classification 	Categorical, Real 	270 	13 		Life
Statlog (Landsat Satellite)	https://archive.ics.uci.edu/ml/datasets/Statlog+%28Landsat+Satellite%29	Multi-spectral values of pixels in 3x3 neighbourhoods in a satellite image, and the classification associated with the central pixel in each neighbourhood	Multivariate 	Classification 	Integer 	6435 	36 	1993 	Physical
Statlog (Image Segmentation)	https://archive.ics.uci.edu/ml/datasets/Statlog+%28Image+Segmentation%29	This dataset is an image segmentation database similar to a database already present in the repository (Image segmentation database) but in a slightly different form.	Multivariate 	Classification 	Real 	2310 	19 	1990 	Other
Statlog (Shuttle)	https://archive.ics.uci.edu/ml/datasets/Statlog+%28Shuttle%29	The shuttle dataset contains 9 attributes all of which are numerical. Approximately 80% of the data belongs to class 1	Multivariate 	Classification 	Integer 	58000 	9 		Physical
Statlog (Vehicle Silhouettes)	https://archive.ics.uci.edu/ml/datasets/Statlog+%28Vehicle+Silhouettes%29	3D objects within a 2D image by application of an ensemble of shape feature extractors to the 2D silhouettes of the objects.	Multivariate 	Classification 	Integer 	946 	18 		Other
Connectionist Bench (Nettalk Corpus)	https://archive.ics.uci.edu/ml/datasets/Connectionist+Bench+%28Nettalk+Corpus%29	The file "nettalk.data" contains a list of 20,008 English words, along with a phonetic transcription for each word. The task is to train a network to produce the proper phonemes	Multivariate 		Categorical 	20008 	4 		Other
Connectionist Bench (Sonar, Mines vs. Rocks)	https://archive.ics.uci.edu/ml/datasets/Connectionist+Bench+%28Sonar%2C+Mines+vs.+Rocks%29	The task is to train a network to discriminate between sonar signals bounced off a metal cylinder and those bounced off a roughly cylindrical rock.	Multivariate 	Classification 	Real 	208 	60 		Physical
Connectionist Bench (Vowel Recognition - Deterding Data)	https://archive.ics.uci.edu/ml/datasets/Connectionist+Bench+%28Vowel+Recognition+-+Deterding+Data%29	Speaker independent recognition of the eleven steady state vowels of British English using a specified training set of lpc derived log area ratios.		Classification 	Real 	528 	10 		Other
Economic Sanctions	https://archive.ics.uci.edu/ml/datasets/Economic+Sanctions	Domain Theory on Economic Sanctions; Undocumented	Domain-Theory 						Financial
Protein Data	https://archive.ics.uci.edu/ml/datasets/Protein+Data	Undocumented							Life
Cloud	https://archive.ics.uci.edu/ml/datasets/Cloud	Little Documentation	Multivariate 		Real 	1024 	10 	1989 	Physical
CalIt2 Building People Counts	https://archive.ics.uci.edu/ml/datasets/CalIt2+Building+People+Counts	This data comes from the main door of the CalIt2 building at UCI.	Multivariate, Time-Series 		Categorical, Integer 	10080 	4 	2006 	Other
Dodgers Loop Sensor	https://archive.ics.uci.edu/ml/datasets/Dodgers+Loop+Sensor	Loop sensor data was collected for the Glendale on ramp for the 101 North freeway in Los Angeles	Multivariate, Time-Series 		Categorical, Integer 	50400 	3 	2006 	Other
Poker Hand	https://archive.ics.uci.edu/ml/datasets/Poker+Hand	Purpose is to predict poker hands	Multivariate 	Classification 	Categorical, Integer 	1025010 	11 	2007 	Game
MAGIC Gamma Telescope	https://archive.ics.uci.edu/ml/datasets/MAGIC+Gamma+Telescope	Data are MC generated to simulate registration of high energy gamma particles in an atmospheric Cherenkov telescope	Multivariate 	Classification 	Real 	19020 	11 	2007 	Physical
UJI Pen Characters	https://archive.ics.uci.edu/ml/datasets/UJI+Pen+Characters	Data consists of written characters in a UNIPEN-like format	Multivariate, Sequential 	Classification 	Integer 	1364 		2007 	Computer
Mammographic Mass	https://archive.ics.uci.edu/ml/datasets/Mammographic+Mass	Discrimination of benign and malignant mammographic masses based on BI-RADS attributes and the patient's age.	Multivariate 	Classification 	Integer 	961 	6 	2007 	Life
Forest Fires	https://archive.ics.uci.edu/ml/datasets/Forest+Fires	This is a difficult regression task, where the aim is to predict the burned area of forest fires, in the northeast region of Portugal, by using meteorological and other data (see details at: http://www.dsi.uminho.pt/~pcortez/forestfires).	Multivariate 	Regression 	Real 	517 	13 	2008 	Physical
Reuters Transcribed Subset	https://archive.ics.uci.edu/ml/datasets/Reuters+Transcribed+Subset	This dataset is created by reading out 200 files from the 10 largest Reuters classes and using an Automatic Speech Recognition system to create corresponding transcriptions.	Text 	Classification 		200 		2008 	Business
Bag of Words	https://archive.ics.uci.edu/ml/datasets/Bag+of+Words	This data set contains five text collections in the form of bags-of-words.	Text 	Clustering 	Integer 	8000000 	100000 	2008 	Other
Concrete Compressive Strength	https://archive.ics.uci.edu/ml/datasets/Concrete+Compressive+Strength	Concrete is the most important material in civil engineering. The concrete compressive strength is a highly nonlinear function of age and ingredients.	Multivariate 	Regression 	Real 	1030 	9 	2007 	Physical
Hill-Valley	https://archive.ics.uci.edu/ml/datasets/Hill-Valley	Each record represents 100 points on a two-dimensional graph. When plotted in order (from 1 through 100) as the Y co-ordinate, the points will create either a Hill (a ï¿½bumpï¿½ in the terrain) or a Valley (a ï¿½dipï¿½ in the terrain).	Sequential 	Classification 	Real 	606 	101 	2008 	Other
Arcene	https://archive.ics.uci.edu/ml/datasets/Arcene	ARCENE's task is to distinguish cancer versus normal patterns from mass-spectrometric data. This is a two-class classification problem with continuous input variables. This dataset is one of 5 datasets of the NIPS 2003 feature selection challenge.	Multivariate 	Classification 	Real 	900 	10000 	2008 	Life
Dexter	https://archive.ics.uci.edu/ml/datasets/Dexter	DEXTER is a text classification problem in a bag-of-word representation. This is a two-class classification problem with sparse continuous input variables. This dataset is one of five datasets of the NIPS 2003 feature selection challenge.	Multivariate 	Classification 	Integer 	2600 	20000 	2008 	Other
Dorothea	https://archive.ics.uci.edu/ml/datasets/Dorothea	DOROTHEA is a drug discovery dataset. Chemical compounds represented by structural molecular features must be classified as active (binding to thrombin) or inactive. This is one of 5 datasets of the NIPS 2003 feature selection challenge.	Multivariate 	Classification 	Integer 	1950 	100000 	2008 	Life
Gisette	https://archive.ics.uci.edu/ml/datasets/Gisette	GISETTE is a handwritten digit recognition problem. The problem is to separate the highly confusible digits '4' and '9'. This dataset is one of five datasets of the NIPS 2003 feature selection challenge.	Multivariate 	Classification 	Integer 	13500 	5000 	2008 	Computer
Madelon	https://archive.ics.uci.edu/ml/datasets/Madelon	MADELON is an artificial dataset, which was part of the NIPS 2003 feature selection challenge. This is a two-class classification problem with continuous input variables. The difficulty is that the problem is multivariate and highly non-linear.	Multivariate 	Classification 	Real 	4400 	500 	2008 	Other
Ozone Level Detection	https://archive.ics.uci.edu/ml/datasets/Ozone+Level+Detection	Two ground ozone level data sets are included in this collection. One is the eight hour peak set (eighthr.data), the other is the one hour peak set (onehr.data). Those data were collected from 1998 to 2004 at the Houston, Galveston and Brazoria area.	Multivariate, Sequential, Time-Series 	Classification 	Real 	2536 	73 	2008 	Physical
Abscisic Acid Signaling Network	https://archive.ics.uci.edu/ml/datasets/Abscisic+Acid+Signaling+Network	The objective is to determine the set of boolean rules that describe the interactions of the nodes within this plant signaling network. The dataset includes 300 separate boolean pseudodynamic simulations using an asynchronous update scheme.	Multivariate 	Causal-Discovery 	Integer 	300 	43 	2008 	Life
Parkinsons	https://archive.ics.uci.edu/ml/datasets/Parkinsons	Oxford Parkinson's Disease Detection Dataset	Multivariate 	Classification 	Real 	197 	23 	2008 	Life
Character Trajectories	https://archive.ics.uci.edu/ml/datasets/Character+Trajectories	Multiple, labelled samples of pen tip trajectories recorded whilst writing individual characters. All samples are from the same writer, for the purposes of primitive extraction. Only characters with a single pen-down segment were considered.	Time-Series 	Classification, Clustering 	Real 	2858 	3 	2008 	Computer
Blood Transfusion Service Center	https://archive.ics.uci.edu/ml/datasets/Blood+Transfusion+Service+Center	Data taken from the Blood Transfusion Service Center in Hsin-Chu City in Taiwan -- this is a classification problem.	Multivariate 	Classification 	Real 	748 	5 	2008 	Business
UJI Pen Characters (Version 2)	https://archive.ics.uci.edu/ml/datasets/UJI+Pen+Characters+%28Version+2%29	A pen-based database with more than 11k isolated handwritten characters	Multivariate, Sequential 	Classification 	Integer 	11640 		2009 	Computer
Semeion Handwritten Digit	https://archive.ics.uci.edu/ml/datasets/Semeion+Handwritten+Digit	1593 handwritten digits from around 80 persons were scanned, stretched in a rectangular box 16x16 in a gray scale of 256 values.	Multivariate 	Classification 	Integer 	1593 	256 	2008 	Computer
SECOM	https://archive.ics.uci.edu/ml/datasets/SECOM	Data from a semi-conductor manufacturing process	Multivariate 	Classification, Causal-Discovery 	Real 	1567 	591 	2008 	Computer
Plants	https://archive.ics.uci.edu/ml/datasets/Plants	Data has been extracted from the USDA plants database. It contains all plants (species and genera) in the database and the states of USA and Canada where they occur.	Multivariate 	Clustering 	Categorical 	22632 	70 	2008 	Life
Libras Movement	https://archive.ics.uci.edu/ml/datasets/Libras+Movement	The data set contains 15 classes of 24 instances each. Each class references to a hand movement type in LIBRAS (Portuguese name 'Lï¿½ngua BRAsileira de Sinais', oficial brazilian signal language).	Multivariate, Sequential 	Classification, Clustering 	Real 	360 	91 	2009 	Other
Concrete Slump Test	https://archive.ics.uci.edu/ml/datasets/Concrete+Slump+Test	Concrete is a highly complex material. The slump flow of concrete is not only determined by the water content, but that is also influenced by other concrete ingredients.	Multivariate 	Regression 	Real 	103 	10 	2009 	Computer
Communities and Crime	https://archive.ics.uci.edu/ml/datasets/Communities+and+Crime	Communities within the United States. The data combines socio-economic data from the 1990 US Census, law enforcement data from the 1990 US LEMAS survey, and crime data from the 1995 FBI UCR.	Multivariate 	Regression 	Real 	1994 	128 	2009 	Social
Acute Inflammations	https://archive.ics.uci.edu/ml/datasets/Acute+Inflammations	The data was created by a medical expert as a data set to test the expert system, which will perform the presumptive diagnosis of two diseases of the urinary system.	Multivariate 	Classification 	Categorical, Integer 	120 	6 	2009 	Life
Wine Quality	https://archive.ics.uci.edu/ml/datasets/Wine+Quality	Two datasets are included, related to red and white vinho verde wine samples, from the north of Portugal. The goal is to model wine quality based on physicochemical tests (see [Cortez et al., 2009], http://www3.dsi.uminho.pt/pcortez/wine/).	Multivariate 	Classification, Regression 	Real 	4898 	12 	2009 	Business
URL Reputation	https://archive.ics.uci.edu/ml/datasets/URL+Reputation	Anonymized 120-day subset of the ICML-09 URL data containing 2.4 million examples and 3.2 million features.	Multivariate, Time-Series 	Classification 	Integer, Real 	2396130 	3231961 	2009 	Computer
p53 Mutants	https://archive.ics.uci.edu/ml/datasets/p53+Mutants	The goal is to model mutant p53 transcriptional activity (active vs inactive) based on data extracted from biophysical simulations.	Multivariate 	Classification 	Real 	16772 	5409 	2010 	Life
Parkinsons Telemonitoring	https://archive.ics.uci.edu/ml/datasets/Parkinsons+Telemonitoring	Oxford Parkinson's Disease Telemonitoring Dataset	Multivariate 	Regression 	Integer, Real 	5875 	26 	2009 	Life
Demospongiae	https://archive.ics.uci.edu/ml/datasets/Demospongiae	Marine sponges of the Demospongiae class classification domain.	Multivariate 	Classification 	Integer 	503 		2010 	Life
Opinosis Opinion ⁄ Review	https://archive.ics.uci.edu/ml/datasets/Opinosis+Opinion+%26frasl%3B+Review	This dataset contains sentences extracted from user reviews on a given topic. Example topics are â€œperformance of Toyota Camryâ€ and â€œsound quality of ipod nanoâ€.	Text 			51 		2010 	Computer
Breast Tissue	https://archive.ics.uci.edu/ml/datasets/Breast+Tissue	Dataset with electrical impedance measurements of freshly excised tissue samples from the breast.	Multivariate 	Classification 	Real 	106 	10 	2010 	Life
Cardiotocography	https://archive.ics.uci.edu/ml/datasets/Cardiotocography	The dataset consists of measurements of fetal heart rate (FHR) and uterine contraction (UC) features on cardiotocograms classified by expert obstetricians.	Multivariate 	Classification 	Real 	2126 	23 	2010 	Life
Wall-Following Robot Navigation Data	https://archive.ics.uci.edu/ml/datasets/Wall-Following+Robot+Navigation+Data	The data were collected as the SCITOS G5 robot navigates through the room following the wall in a clockwise direction, for 4 rounds, using 24 ultrasound sensors arranged circularly around its 'waist'.	Multivariate, Sequential 	Classification 	Real 	5456 	24 	2010 	Computer
Spoken Arabic Digit	https://archive.ics.uci.edu/ml/datasets/Spoken+Arabic+Digit	This dataset contains timeseries of mel-frequency cepstrum coefficients (MFCCs) corresponding to spoken Arabic digits. Includes data from 44 male and 44 female native Arabic speakers.	Multivariate, Time-Series 	Classification 	Real 	8800 	13 	2010 	Other
Localization Data for Person Activity	https://archive.ics.uci.edu/ml/datasets/Localization+Data+for+Person+Activity	Data contains recordings of five people performing different activities. Each person wore four sensors (tags) while performing the same scenario five times.	Univariate, Sequential, Time-Series 	Classification 	Real 	164860 	8 	2010 	Life
AutoUniv	https://archive.ics.uci.edu/ml/datasets/AutoUniv	AutoUniv is an advanced data generator for classifications tasks. The aim is to reflect the nuances and heterogeneity of real data. Data can be generated in .csv, ARFF or C4.5 formats.	Multivariate 	Classification 	Categorical, Integer, Real 			2010 	Other
Steel Plates Faults	https://archive.ics.uci.edu/ml/datasets/Steel+Plates+Faults	A dataset of steel platesâ€™ faults, classified into 7 different types. The goal was to train machine learning for automatic pattern recognition.	Multivariate 	Classification 	Integer, Real 	1941 	27 	2010 	Physical
MiniBooNE particle identification	https://archive.ics.uci.edu/ml/datasets/MiniBooNE+particle+identification	This dataset is taken from the MiniBooNE experiment and is used to distinguish electron neutrinos (signal) from muon neutrinos (background).	Multivariate 	Classification 	Real 	130065 	50 	2010 	Physical
YearPredictionMSD	https://archive.ics.uci.edu/ml/datasets/YearPredictionMSD	Prediction of the release year of a song from audio features. Songs are mostly western, commercial tracks ranging from 1922 to 2011, with a peak in the year 2000s.	Multivariate 	Regression 	Real 	515345 	90 	2011 	Other
PEMS-SF	https://archive.ics.uci.edu/ml/datasets/PEMS-SF	15 months worth of daily data (440 daily records) that describes the occupancy rate, between 0 and 1, of different car lanes of the San Francisco bay area freeways across time.	Multivariate, Time-Series 	Classification 	Real 	440 	138672 	2011 	Computer
OpinRank Review Dataset	https://archive.ics.uci.edu/ml/datasets/OpinRank+Review+Dataset	This data set contains user reviews of cars and and hotels collected from Tripadvisor (~259,000 reviews) and Edmunds (~42,230 reviews).	Text 					2011 	Computer
Relative location of CT slices on axial axis	https://archive.ics.uci.edu/ml/datasets/Relative+location+of+CT+slices+on+axial+axis	The dataset consists of 384 features extracted from CT images. The class variable is numeric and denotes the relative location of the CT slice on the axial axis of the human body.	Domain-Theory 	Regression 	Real 	53500 	386 	2011 	Computer
